title_pt,original_title,runtime,tagline,genres,backdrop_url,poster_url,director,personal_rating,launching_year,tmdb_id
Superman,Superman,128,Olhe para cima.,"Ficção científica, Aventura, Ação",https://image.tmdb.org/t/p/w500/aJDLz1748CIMZkCkyISYe5Hl6I7.jpg,https://image.tmdb.org/t/p/w500/xeZ8oG6W60fEPf9yCjERUXiHRBF.jpg,James Gunn,9.0,2025,1061474
Quarteto Fantástico: Primeiros Passos,The Fantastic 4: First Steps,115,Bem-vindos à família.,"Ficção científica, Aventura, Ação",https://image.tmdb.org/t/p/w500/s94NjfKkcSczZ1FembwmQZwsuwY.jpg,https://image.tmdb.org/t/p/w500/hlWOAWRKSno6UxaE0IXDFVvmzTf.jpg,Matt Shakman,7.0,2025,617126
Uma Caminhada na Floresta,A Walk in the Woods,104,,"Aventura, Comédia, Drama",https://image.tmdb.org/t/p/w500/oXj7C4IuTTtA2iR7hCYtGRy0BS1.jpg,https://image.tmdb.org/t/p/w500/32VIPl1RG9BgJUuydK6qUdjFzCo.jpg,Ken Kwapis,7.0,2015,232572
Menina de Ouro,Million Dollar Baby,132,"Além de seu silêncio, existe um passado. Além de seus sonhos, há um sentimento. Além da esperança, existe uma memória. Além de sua jornada, existe um amor.",Drama,https://image.tmdb.org/t/p/w500/oGMomeS7bE43eN8SGJUaKvQnmud.jpg,https://image.tmdb.org/t/p/w500/edzbBaAHoJGvmNtY2Qck936AgnI.jpg,Clint Eastwood,9.0,2004,70
Ficção Americana,American Fiction,117,,"Comédia, Drama",https://image.tmdb.org/t/p/w500/3mpgltEMgPf8zFtPnAWdDVN8ZT1.jpg,https://image.tmdb.org/t/p/w500/bndwT7YCJv9nEHGSXuzvx9PJ013.jpg,Cord Jefferson,9.0,2023,1056360
O Aprendiz,The Apprentice,120,,"História, Drama",https://image.tmdb.org/t/p/w500/kv9xVrxfLpudBLyYf1QvLCpUQuy.jpg,https://image.tmdb.org/t/p/w500/kSXqBw3QzKqSx8ZAeWL9ms1zw2n.jpg,Ali Abbasi,8.8,2024,1182047
Ratos e Homens,Of Mice and Men,110,Nós temos um sonho. Um lugar para chamar de lar.,Drama,https://image.tmdb.org/t/p/w500/5HVwz8cImMEwcV2z1SMFyJHY51q.jpg,https://image.tmdb.org/t/p/w500/lnecIARJi0C2n5VuDOcVNZmU38.jpg,Gary Sinise,7.5,1992,9609
Conclave,Conclave,120,O que acontece entre estas paredes vai mudar tudo.,"Drama, Thriller",https://image.tmdb.org/t/p/w500/eZzNdjNDvaSoyywy9ICg2UmFwul.jpg,https://image.tmdb.org/t/p/w500/wWn78TMMw8yOdr5sG0Yl9v4saoA.jpg,Edward Berger,8.9,2024,974576
Green Book: O Guia,Green Book,131,Inspirado em uma amizade verdadeira,"Drama, Comédia, História",https://image.tmdb.org/t/p/w500/5En0fmDagt3Pk8d7P3uTwfeQceg.jpg,https://image.tmdb.org/t/p/w500/u9dldwRwQjTZGlIxKaAtAPLAjOv.jpg,Peter Farrelly,9.0,2018,490132
Sniper Americano,American Sniper,132,O atirador mais letal na história dos Estados Unidos.,"Guerra, Ação",https://image.tmdb.org/t/p/w500/rl95VDEP3nsUQmGzE0S1S7y6T0N.jpg,https://image.tmdb.org/t/p/w500/mAXzc2oDTTYcnn6IGHlSXvmXloG.jpg,Clint Eastwood,8.7,2014,190859
Perfume de Mulher,Scent of a Woman,156,O Coronel Frank Slade tem um plano muito especial para o fim de semana!,Drama,https://image.tmdb.org/t/p/w500/fa03pD2qYmms4ZMgAv7PMqfFiGO.jpg,https://image.tmdb.org/t/p/w500/7vYWmKziZCfuXuIesRdVHUtXaLY.jpg,Martin Brest,8.0,1992,9475
Uma Mente Brilhante,A Beautiful Mind,135,Ele viu o mundo de uma maneira que ninguém poderia imaginar.,"Drama, Romance",https://image.tmdb.org/t/p/w500/vVBcIN68kFq681b4lObiNJhEVro.jpg,https://image.tmdb.org/t/p/w500/8K5W9QnNT7r1V9GuJ5z5KlrROkd.jpg,Ron Howard,8.0,2001,453
Quero Ser Grande,Big,105,Você já teve um segredo realmente grande?,"Fantasia, Drama, Comédia",https://image.tmdb.org/t/p/w500/bi9ihIMB9DoXs7odkS5oKkHoK2o.jpg,https://image.tmdb.org/t/p/w500/6RP9H4BobYPU1J2BfgcvYkWJcAY.jpg,Penny Marshall,8.8,1988,2280
A Grande Virada,The Company Men,104,,Drama,https://image.tmdb.org/t/p/w500/nGYko5jtVcdk2csEDX66e87aBWJ.jpg,https://image.tmdb.org/t/p/w500/y8RneyB6GvdHLx0zv3nU53wh5BB.jpg,John Wells,7.0,2010,44129
Gênio Indomável,Good Will Hunting,126,"Algumas pessoas nunca conseguem acreditar em si mesmas, até que alguém acredite nelas.",Drama,https://image.tmdb.org/t/p/w500/bpV8wn48s82au37QyUJ51S7X2Vf.jpg,https://image.tmdb.org/t/p/w500/dTe3EpJGnfUeR5swLbWv61iRyFc.jpg,Gus Van Sant,9.0,1997,489
Uma Vida em Sete Dias,Life or Something Like It,103,,"Comédia, Drama, Romance",https://image.tmdb.org/t/p/w500/AwkaTlvHAc5qQksrXg982CWMkYJ.jpg,https://image.tmdb.org/t/p/w500/g4T8KbMijAqQl1qZrXLwa3r2GOY.jpg,Stephen Herek,7.3,2002,16643
O Amor Não Tira Férias,The Holiday,136,É véspera de Natal e vamos celebrar ser jovens e estar vivos.,"Comédia, Romance",https://image.tmdb.org/t/p/w500/pvVpR8lPRAPbeVU6hqJwD4r9roo.jpg,https://image.tmdb.org/t/p/w500/4TvrnjDdIACRp9Jy4KWO3VxrUrg.jpg,Nancy Meyers,7.9,2006,1581
O Grinch,How the Grinch Stole Christmas,105,Ele traz a maldade para o verde.,"Família, Comédia, Fantasia",https://image.tmdb.org/t/p/w500/sy0vo1cmpKqwPRiMUiJ45jyLsX7.jpg,https://image.tmdb.org/t/p/w500/iVvFVBcdUMPgPCnLFICzBEwZxgZ.jpg,Ron Howard,8.0,2000,8871
Duro de Matar,Die Hard,132,Doze terroristas. Um policial. As probabilidades estão contra John McClane... É assim que ele gosta.,"Ação, Thriller",https://image.tmdb.org/t/p/w500/bvk2AAH64lP2YZs02Q3jskfHT8j.jpg,https://image.tmdb.org/t/p/w500/2PD0HHoyVVAEUhep9JhlKtgyl8m.jpg,John McTiernan,8.5,1988,562
Trapaça,American Hustle,138,Todo mundo trapaceia para sobreviver,"Drama, Crime",https://image.tmdb.org/t/p/w500/bof71DUdBb5FwTylar4rnIVd8z.jpg,https://image.tmdb.org/t/p/w500/hDvBteFNrro6e4UdHBenC0hbDio.jpg,David O. Russell,-1.0,2014,168672
O Beco do Pesadelo,Nightmare Alley,151,Homem ou Fera.,"Crime, Drama, Thriller",https://image.tmdb.org/t/p/w500/g0YNGpmlXsgHfhGnJz3c5uyzZ1B.jpg,https://image.tmdb.org/t/p/w500/nndZUt9Lf8ZwefYBTGe5opGLJuY.jpg,Guillermo del Toro,-1.0,2021,597208
Quatro Casamentos e um Funeral,Four Weddings and a Funeral,117,Cinco boas razões para permanecer solteiro.,"Comédia, Drama, Romance",https://image.tmdb.org/t/p/w500/ejFaHWnDP29z7ePw2cJVOsWvOvH.jpg,https://image.tmdb.org/t/p/w500/wMiCfPLgpVoyGQ5veOYGDhduJ22.jpg,Mike Newell,-1.0,1994,712
Asteroid City,Asteroid City,105,,"Comédia, Drama",https://image.tmdb.org/t/p/w500/iloUOSs3Rcq3aMr04CrGRWVVBkq.jpg,https://image.tmdb.org/t/p/w500/kpXzQHuz4i6iLhxsMNxsgmjzoQT.jpg,Wes Anderson,-1.0,2023,747188
Capitão Fantástico,Captain Fantastic,118,Ele os preparou para tudo exceto o mundo.,"Aventura, Drama",https://image.tmdb.org/t/p/w500/d84M69u6Q202dm6EvhVxbiqrK9f.jpg,https://image.tmdb.org/t/p/w500/t4UH0AJql4paQMq4Dlg1gk2tqhk.jpg,Matt Ross,-1.0,2016,334533
